{
  "$schema": "http://json-schema.org/draft-04/schema#",
  "description": "Multi-Item Request Submission Result",
  "type": "object",
  "properties": {
    "batchId": {
      "type": "string",
      "pattern": "^[0-9a-fA-F]{8}-[0-9a-fA-F]{4}-[1-5][0-9a-fA-F]{3}-[89abAB][0-9a-fA-F]{3}-[0-9a-fA-F]{12}$",
      "description": "The UUID id of the batch request"
    },
    "requesterId": {
      "type": "string",
      "pattern": "^[0-9a-fA-F]{8}-[0-9a-fA-F]{4}-[1-5][0-9a-fA-F]{3}-[89abAB][0-9a-fA-F]{3}-[0-9a-fA-F]{12}$",
      "description": "The UUID id of the requester"
    },
    "mediatedRequestStatus": {
      "description": "Status of the submitted mediated batch request",
      "type": "string",
      "enum": [
        "Pending",
        "In progress",
        "Completed",
        "Failed"
      ]
    },
    "itemRequestsStats": {
      "type": "object",
      "description": "Statistics about the item requests in the batch",
      "properties": {
        "total": {
          "type": "integer",
          "description": "Total number of item requests in the batch"
        },
        "pending": {
          "type": "integer",
          "description": "Number of item requests still pending creation"
        },
        "inProgress": {
          "type": "integer",
          "description": "Number of item requests currently being created"
        },
        "completed": {
          "type": "integer",
          "description": "Number of successfully created item requests"
        },
        "failed": {
          "type": "integer",
          "description": "Number of item requests that failed to be created"
        }
      }
    },
    "metadata": {
      "type": "object",
      "$ref": "raml-util/schemas/metadata.schema"
    }
  },
  "required": [
    "batchId",
    "requesterId",
    "mediatedRequestStatus"
  ]
}
