{
  "batchId": "5203c035-005e-4a70-b555-ddaa3094c51c",
  "requesterId": "1ec54964-70f0-44cc-bd19-2a892ea0d336",
  "mediatedRequestStatus": "Pending",
  "itemRequestsStats": {
    "total": 2,
    "pending": 2,
    "inProgress": 0,
    "completed": 0,
    "failed": 0
  },
  "metadata": {
    "createdDate": "2025-09-08T12:27:33.822+00:00",
    "createdByUserId": "1ec54964-70f0-44cc-bd19-2a892ea0d336",
    "createdByUsername": "patron",
    "updatedDate": "2025-09-08T12:27:33.822+00:00",
    "updatedByUserId": "1ec54964-70f0-44cc-bd19-2a892ea0d336",
    "updatedByUsername": "patron"
  }
}
